{
  "environment": {
    "cuda_available": false,
    "cuda_version": null,
    "cudnn_version": null,
    "driver_version": null,
    "env_vars": {},
    "git_dirty": false,
    "gpu_count": 0,
    "gpu_models": [],
    "hostname": "MacBook-Pro-4.local",
    "litgpt_version": null,
    "nccl_version": null,
    "numpy_version": "2.5.1",
    "olm_commit": "2f99ff43e352c738f5b6e76e3e7304c7fc9fb44d",
    "olm_version": "2.2.0",
    "platform": "macOS-26.5.1-arm64-arm-64bit",
    "python_version": "3.12.13 (main, Mar  3 2026, 12:39:30) [Clang 21.0.0 (clang-2100.0.123.102)]",
    "timestamp_utc": "2026-07-16T07:52:16.653443+00:00",
    "torch_version": "2.13.0",
    "transformers_version": "5.14.0"
  },
  "families": [
    {
      "checks": {
        "checkpoint_roundtrip_bitwise": "pass",
        "reduced_forward_smoke": "pass",
        "reduced_param_count_matches_formula": "pass",
        "tied_embedding_behavior": "pass"
      },
      "family": "gpt2",
      "reduced_config": {
        "dropout": 0.0,
        "embed_dim": 32,
        "max_seq_len": 16,
        "num_heads": 4,
        "num_layers": 2,
        "vocab_size": 128
      }
    },
    {
      "checks": {
        "checkpoint_roundtrip_bitwise": "pass",
        "reduced_forward_smoke": "pass",
        "reduced_param_count_matches_formula": "pass",
        "tied_embedding_behavior": "pass"
      },
      "family": "llama2",
      "reduced_config": {
        "embed_dim": 32,
        "intermediate_size": 64,
        "max_seq_len": 16,
        "num_heads": 4,
        "num_kv_heads": 4,
        "num_layers": 2,
        "vocab_size": 128
      }
    },
    {
      "checks": {
        "checkpoint_roundtrip_bitwise": "pass",
        "reduced_forward_smoke": "pass",
        "reduced_param_count_matches_formula": "pass",
        "tied_embedding_behavior": "pass"
      },
      "family": "llama3",
      "reduced_config": {
        "embed_dim": 32,
        "intermediate_size": 64,
        "max_seq_len": 16,
        "num_heads": 4,
        "num_kv_heads": 2,
        "num_layers": 2,
        "vocab_size": 128
      }
    },
    {
      "checks": {
        "checkpoint_roundtrip_bitwise": "pass",
        "reduced_forward_smoke": "pass",
        "reduced_param_count_matches_formula": "pass",
        "tied_embedding_behavior": "pass"
      },
      "family": "qwen2",
      "reduced_config": {
        "embed_dim": 32,
        "intermediate_size": 64,
        "max_seq_len": 16,
        "num_heads": 4,
        "num_kv_heads": 2,
        "num_layers": 2,
        "rope_theta": 10000.0,
        "vocab_size": 128
      }
    },
    {
      "checks": {
        "checkpoint_roundtrip_bitwise": "pass",
        "reduced_forward_smoke": "pass",
        "reduced_param_count_matches_formula": "pass",
        "tied_embedding_behavior": "pass"
      },
      "family": "phi3",
      "reduced_config": {
        "embed_dim": 32,
        "intermediate_size": 64,
        "max_seq_len": 16,
        "num_heads": 4,
        "num_kv_heads": 4,
        "num_layers": 2,
        "vocab_size": 128
      }
    },
    {
      "checks": {
        "checkpoint_roundtrip_bitwise": "pass",
        "reduced_forward_smoke": "pass",
        "reduced_param_count_matches_formula": "pass",
        "tied_embedding_behavior": "pass"
      },
      "family": "phi4",
      "reduced_config": {
        "embed_dim": 32,
        "intermediate_size": 64,
        "max_seq_len": 16,
        "num_heads": 4,
        "num_kv_heads": 2,
        "num_layers": 2,
        "vocab_size": 128
      }
    },
    {
      "checks": {
        "checkpoint_roundtrip_bitwise": "pass",
        "reduced_forward_smoke": "pass",
        "reduced_param_count_matches_formula": "pass",
        "tied_embedding_behavior": "pass"
      },
      "family": "gemma2",
      "reduced_config": {
        "embed_dim": 32,
        "head_dim": 8,
        "intermediate_size": 64,
        "max_seq_len": 16,
        "num_heads": 4,
        "num_kv_heads": 2,
        "num_layers": 2,
        "vocab_size": 128
      }
    },
    {
      "checks": {
        "checkpoint_roundtrip_bitwise": "pass",
        "reduced_forward_smoke": "pass",
        "reduced_param_count_matches_formula": "pass",
        "tied_embedding_behavior": "pass"
      },
      "family": "olmo",
      "reduced_config": {
        "embed_dim": 32,
        "intermediate_size": 64,
        "max_seq_len": 16,
        "num_heads": 4,
        "num_layers": 2,
        "vocab_size": 128
      }
    },
    {
      "checks": {
        "checkpoint_roundtrip_bitwise": "pass",
        "reduced_forward_smoke": "pass",
        "reduced_param_count_matches_formula": "pass",
        "tied_embedding_behavior": "pass"
      },
      "family": "opt",
      "reduced_config": {
        "dropout": 0.0,
        "embed_dim": 32,
        "intermediate_size": 64,
        "num_heads": 4,
        "num_layers": 2,
        "vocab_size": 128
      }
    }
  ],
  "olm_commit": "2f99ff43e352c738f5b6e76e3e7304c7fc9fb44d",
  "presets": [
    {
      "checks": {
        "constructor_config_matches_manifest": "pass",
        "formula_param_count": 124439808,
        "formula_param_count_in_expected_range": "pass",
        "tie_setting_matches_manifest": "pass"
      },
      "family": "gpt2",
      "preset": "GPT2"
    },
    {
      "checks": {
        "constructor_config_matches_manifest": "pass",
        "formula_param_count": 354823168,
        "formula_param_count_in_expected_range": "pass",
        "tie_setting_matches_manifest": "pass"
      },
      "family": "gpt2",
      "preset": "GPT2Medium"
    },
    {
      "checks": {
        "constructor_config_matches_manifest": "pass",
        "formula_param_count": 774030080,
        "formula_param_count_in_expected_range": "pass",
        "tie_setting_matches_manifest": "pass"
      },
      "family": "gpt2",
      "preset": "GPT2Large"
    },
    {
      "checks": {
        "constructor_config_matches_manifest": "pass",
        "formula_param_count": 1557611200,
        "formula_param_count_in_expected_range": "pass",
        "tie_setting_matches_manifest": "pass"
      },
      "family": "gpt2",
      "preset": "GPT2XL"
    },
    {
      "checks": {
        "constructor_config_matches_manifest": "pass",
        "formula_param_count": 6607343616,
        "formula_param_count_in_expected_range": "pass",
        "tie_setting_matches_manifest": "pass"
      },
      "family": "llama2",
      "preset": "Llama2_7B"
    },
    {
      "checks": {
        "constructor_config_matches_manifest": "pass",
        "formula_param_count": 12852024320,
        "formula_param_count_in_expected_range": "pass",
        "tie_setting_matches_manifest": "pass"
      },
      "family": "llama2",
      "preset": "Llama2_13B"
    },
    {
      "checks": {
        "constructor_config_matches_manifest": "pass",
        "formula_param_count": 68714504192,
        "formula_param_count_in_expected_range": "pass",
        "tie_setting_matches_manifest": "pass"
      },
      "family": "llama2",
      "preset": "Llama2_70B"
    },
    {
      "checks": {
        "constructor_config_matches_manifest": "pass",
        "formula_param_count": 7504924672,
        "formula_param_count_in_expected_range": "pass",
        "tie_setting_matches_manifest": "pass"
      },
      "family": "llama3",
      "preset": "Llama3_1_8B"
    },
    {
      "checks": {
        "constructor_config_matches_manifest": "pass",
        "formula_param_count": 69503033344,
        "formula_param_count_in_expected_range": "pass",
        "tie_setting_matches_manifest": "pass"
      },
      "family": "llama3",
      "preset": "Llama3_1_70B"
    },
    {
      "checks": {
        "constructor_config_matches_manifest": "pass",
        "formula_param_count": 403752042496,
        "formula_param_count_in_expected_range": "pass",
        "tie_setting_matches_manifest": "pass"
      },
      "family": "llama3",
      "preset": "Llama3_1_405B"
    },
    {
      "checks": {
        "constructor_config_matches_manifest": "pass",
        "formula_param_count": 1235814400,
        "formula_param_count_in_expected_range": "pass",
        "tie_setting_matches_manifest": "pass"
      },
      "family": "llama3",
      "preset": "Llama3_2_1B"
    },
    {
      "checks": {
        "constructor_config_matches_manifest": "pass",
        "formula_param_count": 3212749824,
        "formula_param_count_in_expected_range": "pass",
        "tie_setting_matches_manifest": "pass"
      },
      "family": "llama3",
      "preset": "Llama3_2_3B"
    },
    {
      "checks": {
        "constructor_config_matches_manifest": "pass",
        "formula_param_count": 494032768,
        "formula_param_count_in_expected_range": "pass",
        "tie_setting_matches_manifest": "pass"
      },
      "family": "qwen2",
      "preset": "Qwen2_5_0_5B"
    },
    {
      "checks": {
        "constructor_config_matches_manifest": "pass",
        "formula_param_count": 1543714304,
        "formula_param_count_in_expected_range": "pass",
        "tie_setting_matches_manifest": "pass"
      },
      "family": "qwen2",
      "preset": "Qwen2_5_1_5B"
    },
    {
      "checks": {
        "constructor_config_matches_manifest": "pass",
        "formula_param_count": 3085938688,
        "formula_param_count_in_expected_range": "pass",
        "tie_setting_matches_manifest": "pass"
      },
      "family": "qwen2",
      "preset": "Qwen2_5_3B"
    },
    {
      "checks": {
        "constructor_config_matches_manifest": "pass",
        "formula_param_count": 7070619136,
        "formula_param_count_in_expected_range": "pass",
        "tie_setting_matches_manifest": "pass"
      },
      "family": "qwen2",
      "preset": "Qwen2_5_7B"
    },
    {
      "checks": {
        "constructor_config_matches_manifest": "pass",
        "formula_param_count": 13991465984,
        "formula_param_count_in_expected_range": "pass",
        "tie_setting_matches_manifest": "pass"
      },